{
  "title": "OpenAI 官方提示词指南：普通人用 ChatGPT 写文案别再空话",
  "quality_spec": {
    "target_quality_level": "high_quality",
    "visual_system": "dark proof-card tutorial with crisp UI evidence",
    "motion_policy": "useful motion only; no shake, no random drift, no Ken Burns as main motion",
    "still_image_policy": "split dense images into steps and reveal one point per voice beat",
    "evidence_policy": "real UI and output proof first; generated visuals only support explanation",
    "sfx_policy": "subtle click, card insert, and marker sweep below narration",
    "render_policy": "HyperFrames quality high plus high-bitrate H.264 pass when needed",
    "cover_policy": "standalone poster cover, not a random frame grab",
    "frame_review_policy": "review first 5 seconds, full contact sheet, and crowded detail frames",
    "provider_policy": "free_first_local_or_authorized_openai_only",
    "runtime_choice": "HyperFrames final timeline; Remotion component clips when needed; FFmpeg only for mechanical media",
    "caption_template_plan": "mix proof_callout, chapter_card, word_highlight, comparison_label, terminal_code_caption, and final_takeaway",
    "timeline_contract_ref": "internal/timeline_contract.md",
    "narration_continuity_policy": "single continuous root narration audio; visual transitions never restart, mute, fade, or gap voice; max planned transition audio gap 80ms"
  },
  "target": {
    "width": 1920,
    "height": 1080,
    "fps": 30,
    "tts_speed": 1.0,
    "voice_speed_policy": "normal",
    "provider_policy": "free_first_local_or_authorized_openai_only"
  },
  "director_shots": [
    {
      "shot_id": "S01",
      "duration_sec": 2.4,
      "shot_type": "hook_conflict",
      "layout_family": "workspace_ui",
      "camera_scale": "macro_closeup",
      "camera_motion": "push_in",
      "visual_subject": "ChatGPT 输入框里只有一句模糊需求，右侧输出变成空话警告",
      "primary_action": "模糊提示词被红色框选，空话输出标签快速落下",
      "viewer_focus": "观众先看到错误任务如何制造空话",
      "operation_elements": ["task_brief_panel"],
      "evidence": {
        "type": "real_ui_capture",
        "asset_id": "A001",
        "must_be_readable": true,
        "min_visible_width_px": 1100
      },
      "on_screen_text": {
        "primary": "空话输出",
        "secondary": ["少了限制条件"],
        "approved_primary_text": ["空话输出"]
      },
      "forbidden_risks": ["empty_frame", "tiny_unreadable_text", "same_layout_repetition"]
    },
    {
      "shot_id": "S02",
      "duration_sec": 2.6,
      "shot_type": "source_evidence",
      "layout_family": "source_crop",
      "camera_scale": "closeup",
      "camera_motion": "zoom_in",
      "visual_subject": "真实界面局部和一张干净来源说明卡并排展示限制条件",
      "primary_action": "镜头推近对象、场景、格式三个限制条件",
      "viewer_focus": "观众确认方法来自可见示例而不是抽象口号",
      "operation_elements": ["source_citation"],
      "evidence": {
        "type": "real_source_crop",
        "asset_id": "A001",
        "source_title": "ChatGPT prompt comparison capture",
        "source_url": "local://assets/screenshots/s01.png",
        "must_be_readable": true,
        "min_visible_width_px": 1100
      },
      "on_screen_text": {
        "primary": "限制条件结构",
        "secondary": ["对象", "场景", "格式"],
        "approved_primary_text": ["限制条件结构"]
      },
      "forbidden_risks": ["fake_official_screenshot", "tiny_unreadable_text", "empty_frame"]
    },
    {
      "shot_id": "S03",
      "duration_sec": 4.0,
      "shot_type": "operation_simulation",
      "layout_family": "repo_file_tree",
      "camera_scale": "medium",
      "camera_motion": "tracking",
      "visual_subject": "左侧是提示词 brief，右侧像文件树一样展开目标用户、语气、禁区",
      "primary_action": "目标用户条件从 brief 面板拖入正式提示词",
      "viewer_focus": "观众看到限制条件如何进入实际操作",
      "operation_elements": ["task_brief_panel", "repo_or_file_tree"],
      "evidence": {
        "type": "real_ui_capture",
        "asset_id": "A002",
        "must_be_readable": true,
        "min_visible_width_px": 1000
      },
      "on_screen_text": {
        "primary": "目标用户限制",
        "secondary": ["目标用户：新手店主"],
        "approved_primary_text": ["目标用户限制"]
      },
      "forbidden_risks": ["empty_frame", "same_layout_repetition", "tiny_unreadable_text"]
    },
    {
      "shot_id": "S04",
      "duration_sec": 4.0,
      "shot_type": "method_template",
      "layout_family": "template_card",
      "camera_scale": "medium",
      "camera_motion": "parallax",
      "visual_subject": "三块方法模板卡依次落位：抖音口播、封面标题、商品页",
      "primary_action": "卡片按 0.12 秒错峰进入并形成可保存结构",
      "viewer_focus": "观众记住同一主题要绑定具体使用场景",
      "operation_elements": ["risk_list"],
      "evidence": {
        "type": "abstract_non_official_diagram"
      },
      "on_screen_text": {
        "primary": "使用场景限制",
        "secondary": ["抖音口播", "封面标题", "商品页"],
        "approved_primary_text": ["使用场景限制"]
      },
      "forbidden_risks": ["empty_frame", "crowded_layout", "chaotic_motion", "tiny_unreadable_text"]
    },
    {
      "shot_id": "S05",
      "duration_sec": 4.0,
      "shot_type": "operation_simulation",
      "layout_family": "terminal_output",
      "camera_scale": "closeup",
      "camera_motion": "tracking",
      "visual_subject": "模拟输出面板逐行生成标题、痛点、卖点、行动建议",
      "primary_action": "每个输出字段被测试通过样式勾选",
      "viewer_focus": "观众看到格式限制让结果变得可执行",
      "operation_elements": ["test_or_check_output", "evidence_result_card"],
      "evidence": {
        "type": "terminal_or_file_proof",
        "asset_id": "A002",
        "must_be_readable": true,
        "min_visible_width_px": 1000
      },
      "on_screen_text": {
        "primary": "输出格式限制",
        "secondary": ["标题", "痛点", "卖点", "行动建议"],
        "approved_primary_text": ["输出格式限制"]
      },
      "forbidden_risks": ["empty_frame", "tiny_unreadable_text", "fake_source_panel"]
    },
    {
      "shot_id": "S06",
      "duration_sec": 3.0,
      "shot_type": "final_template",
      "layout_family": "final_cta",
      "camera_scale": "wide",
      "camera_motion": "pull_out",
      "visual_subject": "最终收藏公式卡居中，背景工作区收束成一张可截图模板",
      "primary_action": "公式卡稳定停留，收藏提示轻微出现",
      "viewer_focus": "观众获得可保存的一句话模板",
      "operation_elements": ["evidence_result_card"],
      "evidence": {
        "type": "none"
      },
      "on_screen_text": {
        "primary": "对象 + 场景 + 格式",
        "secondary": ["收藏这条，直接套用"],
        "approved_primary_text": ["对象 + 场景 + 格式"]
      },
      "forbidden_risks": ["empty_frame", "tiny_unreadable_text", "overcrowded_cta"]
    }
  ],
  "scenes": [
    {
      "scene_id": "S01",
      "concept": "错误问法导致空话输出",
      "duration_target": 2.4,
      "voice": "你用 ChatGPT 写文案总是空话，问题可能不是工具。",
      "caption": "问题可能不是工具",
      "on_screen_text": ["空话输出", "少了限制条件"],
      "visual": {
        "scene_type": "screenshot_proof",
        "description": "错误提示词和空泛输出的对比截图",
        "evidence_source": "real_ui_screenshot",
        "asset_path": "assets/screenshots/s01.png",
        "asset_source_type": "proof",
        "caption_template": "proof_callout",
        "proof_chain": {
          "entry_or_source": "真实 ChatGPT 输入和输出截图",
          "operation_or_step": "展示模糊提示词如何导致空泛输出",
          "output_or_result": "空话输出和错误提示词并排出现",
          "viewer_value": "观众知道问题出在提示词限制不够"
        },
        "design_layers": ["dark grid background", "split screenshot frame", "red prompt highlight", "bottom subtitle rail"],
        "quality_checks": {
          "source_resolution_ok": true,
          "text_safe": true,
          "not_template_like": true,
          "not_static_dump": true
        }
      },
      "motion": {
        "background_motion": "subtle grid drift",
        "foreground_motion": "screenshot slides in",
        "callout_motion": "red highlight on vague prompt",
        "transition": "smooth push slide with blur crossfade on sentence boundary",
        "purpose": "reveal",
        "entrance": "0.6s cinematic fade-up from y=20px opacity 0",
        "stagger": "0.12s-0.18s between title/cards",
        "keyword_motion": "subtle scale-pop max 1.08x for 0.25s",
        "camera_motion": "background push-in 100% to 103%, foreground stable",
        "layering": "background parallax + foreground stable + callout reveal",
        "caption_motion": "keyword highlight only, no every-word bouncing",
        "glow": "ambient glow opacity 8%-18%, no flicker",
        "audio_reactive": "text 3%-5%, background glow 10%-15%",
        "negative_motion": "no excessive bounce, no chaotic movement, no glitch spam"
      },
      "sync": {
        "voice_start": 0,
        "voice_end": 2.4,
        "caption_start": 0,
        "caption_end": 2.4,
        "narration_track": "continuous_root_audio",
        "transition_audio_policy": "visual-only transition; narration continues with no restart or mute",
        "max_audio_gap_ms": 80,
        "audio_bridge": "continuous narration bed under visual transition; SFX stays below voice"
      },
      "safe_zone": {
        "top_reserved": true,
        "bottom_caption_reserved": true,
        "right_buttons_reserved": true,
        "top_margin_px": 240,
        "bottom_margin_px": 360,
        "left_margin_px": 72,
        "right_margin_px": 180,
        "critical_content_inside_safe_area": true
      },
      "beat_map": [
        {
          "voice_fragment": "写文案总是空话",
          "visual_action": "左侧出现错误提示词，右侧出现空泛输出",
          "caption": "问题可能不是工具",
          "proof_or_explanation": "错误示例和输出证明",
          "motion_trigger": "红色高亮框锁定模糊提示词"
        }
      ],
      "qa_notes": []
    },
    {
      "scene_id": "S02",
      "concept": "限制条件结构",
      "duration_target": 2.6,
      "voice": "真正要补的是三个限制：对象、场景和格式。",
      "caption": "补三个限制",
      "on_screen_text": ["对象", "场景", "格式"],
      "visual": {
        "scene_type": "text_card",
        "description": "三张限制条件卡片逐个出现",
        "evidence_source": "designed_card",
        "asset_path": "assets/generated/s02.png",
        "asset_source_type": "support",
        "caption_template": "chapter_card",